"Se rendre à pieds pour découvrir notre environnement et qq monuments pour se rendre à ""Maths et puzzles"" à l'espace Mendes France",Clg JV Buxerolles,0860799B,Collège Jules Verne,"Secteur Culture Scientifique et Technique,Patrimoine et archéologie",2 X 24,"Les sciences au cœur du métier,Sciences au cœur du métier",Aucun,
Voyage scolaire en andalousie,college jules vernes,0860799B,Collège Jules Verne,linguistique et culturel,49,sejour linguistique,Aucun,
Poitiers film festival (projection de couts metrages en langue espagnol + echanges avec les realisateurs),college jules verne,0860799B,Collège Jules Verne,Secteur Cinéma - audiovisuel,125,Festival de cinéma,Aucun,Scène Nationale de Poitiers (TAP Poitiers)
Parcours culturels 6ème et 3ème dans la programmation des 3T (spectacle vivant : 3 spectacles dans l'année pour chaque classe),Collège René Descartes Châtellerault,0860984C,Collège René Descartes,Secteur spectacle vivant,300,Parcours culturel local,Aucun,
Parcours culturels 6ème et 3ème dans la programmation des 3T (spectacle vivant : 3 spectacles dans l'année pour chaque classe),Collège René Descartes Châtellerault,0860984C,Collège René Descartes,Secteur spectacle vivant,300,Parcours culturel local,Aucun,
Journée Atelier avec le CEPI poitiers,Collège René Descartes Châtellerault,0860984C,Collège René Descartes,Secteur spectacle vivant,26,Partenariat 3T,Aucun,
Atelier théâtre avec Night Shot (Compagnie de théâtre),Collège René Descartes Châtellerault,0860984C,Collège René Descartes,Secteur spectacle vivant,26,Partenariat 3T,Aucun,
"- Jeunesses Musicales de France
",collège Henri IV,0861071X,Collège Henri IV,Secteur Musique / Chant Choral,125,Élèves  au concert,Aucun,
Collège au cinéma,Collège Henri IV Poitiers,0861071X,Collège Henri IV,Secteur Cinéma - audiovisuel,190,Ecolier collégien lycéen au cinéma,Aucun,Cinéma Cornay
Collégiens au théâtre,Collège Henri IV Poitiers,0861071X,Collège Henri IV,Secteur spectacle vivant,420,Collège au spectacle,Aucun,"La Comédie Poitou-Charentes,Scène Nationale de Poitiers (TAP Poitiers)"
Projet Rencontres Chorales Académiques Atout Chœur dans le cadre de l'APEMEN- Un jour au bon endroit (spectacle autour des chansons de Calogero),PEAC Education musicale,0861071X,Collège Henri IV,Secteur Musique / Chant Choral,43 élèves,Rencontres chorales,Chorale,
"Concerts JMF (jeunesses musicales de France)
2 concerts niveau 3ème : Concert autour de l'Artiste Sophie Maurin + atelier de pratique avec l'artiste pour une classe de 3ème
                niveau 4ème et 5ème : Concert sur la naissance du Jazz",PEAC Education Artistique,0861071X,Collège Henri IV,Secteur Musique / Chant Choral,Environ 263 élèves,Élèves  au concert,Aucun,JM France Territoire Poitou-Charentes
"Projets JMF :
- Concert de Sophie Maurin, chanteuse de la scène actuelle, avec le niveau 3e
",Collège Henri IV,0861071X,Collège Henri IV,"Secteur Musique / Chant Choral,Secteur spectacle vivant",130,JMF,"Ateliers de pratique artistique, scientifique...",JM France Territoire Poitou-Charentes
"Projet JMF :
- Spectacle ""Raconte moi le jazz"" avec le niveau 5e-4e",Collège Henri IV,0861071X,Collège Henri IV,"Secteur Musique / Chant Choral,Secteur spectacle vivant",140,JMF,Aucun,JM France Territoire Poitou-Charentes
"Atelier musique : Groupe d'élèves volontaires constituent un groupe faisant des reprises de chansons actuelles (percus, piano, guitare, chant)",Collège Henri IV,0861071X,Collège Henri IV,"Secteur Musique / Chant Choral,Secteur spectacle vivant",10,FSE,"Ateliers de pratique artistique, scientifique...",
Cyberombre,Collège Camille Guérin,0861092V,Collège Camille Guérin,Secteur spectacle vivant,110,Collège au spectacle,"Ateliers de pratique artistique, scientifique...","La Comédie Poitou-Charentes,La Maison persane"
Contes africains,Collège Camille Guérin,0861092V,Collège Camille Guérin,Secteur spectacle vivant,110,?,Aucun,Théâtre de l'Etincelle
Le Confort en chantier,Collège Camille Guérin,0861092V,Collège Camille Guérin,Arts plastiques,110,?,Aucun,Le confort moderne
Séances anglaises,Collège Camille Guérin,0861092V,Collège Camille Guérin,Secteur Cinéma - audiovisuel,110,Festival de cinéma,Aucun,Scène Nationale de Poitiers (TAP Poitiers)
